1;eng;Базовый английский ;Курс для равномерного изучения языка в течение учебного года. Курс включает 166 академических часов. Цена указана за учебный месяц.;10000;first.jpg
2;eng;Интенсивный английский ;Курс для ускоренного изучения английского языка. Содержит основные принципы и конструкции. Курс включает 83 академических часа. Цена  указана за весь курс. ;40000;second.jpg
3;eng;Бизнес-английский ;Курс делового английского. Курс включает 83 академических часа. Цена указана за курс. ;50000;third.jpg
4;bus;Основы маркетинга;Курс описывает базовые принципы маркетинга, которые помогут вам увеличить рыночную долю компании. Курс включает 20 академических часов часов.;30000;first.jpg
5;bus;Основы бизнеса;Курс описывает базовые принципы запуска бизнеса, основные процессы и структуры компании. Курс включает 10 академических часов. ;30000;second.jpg
6;bus;Основы менеджмента;Курс научит вас выстраивать грамотную систему мотивации  сотрудников и структуру отделов. Курс включает  10 академических чассов. ;30000;third.jpg